place_name,address,latitude,longitude,name,editorial_summary,reviews,type,price_level,rating,best_time_to_visit,average_duration_to_spend
The Museum of Modern Art (MoMA),"11 W 53rd St, New York, NY 10019, USA",40.7614327,-73.97762159999999,The Museum of Modern Art,"{'language': 'en', 'overview': 'Works from van Gogh to Warhol & beyond plus a sculpture garden, 2 cafes & The Modern restaurant.'}","[{'author_name': 'Frankie Rodriguez', 'author_url': 'https://www.google.com/maps/contrib/112215069813271765756/reviews', 'language': 'en', 'original_language': 'en', 'profile_photo_url': 'https://lh3.googleusercontent.com/a-/ALV-UjWBnBhOQ8EMLjCqb6K_GihB2WwjDCu8TMjbCVcyvWRNUMoH=s128-c0x00000000-cc-rp-mo-ba5', 'rating': 5, 'relative_time_description': 'in the last week', 'text': ""Nothing but great times here. I enjoyed every exhibition they had there. Especially the Picasso. Beautiful!!!. They had a bomb shelter made in a fake basement that took you back in history. Wonderful sculptures also. What a blast I had looking at the interactive wall of art. What a phenomenal place. The MoMA is a must stop if you are in NYC. Definitely a must. You won't be disappointed. Believe me. The price is not bad at all. Very low for a NYC museum."", 'time': 1698429276, 'translated': False}, {'author_name': 'D D', 'author_url': 'https://www.google.com/maps/contrib/106011099026906865702/reviews', 'language': 'en', 'original_language': 'en', 'profile_photo_url': 'https://lh3.googleusercontent.com/a-/ALV-UjWSG3fwhaWcsQp1ntY-aCg3GHvSNbJPzOCK7OvVxc6tVjc=s128-c0x00000000-cc-rp-mo-ba5', 'rating': 4, 'relative_time_description': 'in the last week', 'text': ""I have been coming here since 1997. Always a pleasure to see what's new or recent in the art world.\n\nThe wonderful thing about this museum is the fact that you can see the whole museum in a day.\n\nMy recommendation is to start on the top floor, and make your way down ending in the garden and or the store."", 'time': 1698343269, 'translated': False}, {'author_name': 'Andy Jenkins', 'author_url': 'https://www.google.com/maps/contrib/103160999552328578883/reviews', 'language': 'en', 'original_language': 'en', 'profile_photo_url': 'https://lh3.googleusercontent.com/a-/ALV-UjX4gi9Jf-nNBAXDOnfvXW-phojsPS4YI-lb2nVu4Lw_FzX_=s128-c0x00000000-cc-rp-mo-ba5', 'rating': 5, 'relative_time_description': 'a week ago', 'text': 'This is a fantastic museum which has so many works of art to take in.\n\nWe spent several hours there, something like 5 hours taking it all in so be prepared for that. There are places to sit which was well received.\n\nTry not to focus just on the heavy hitters like Gogh and Monet, there are other artists and subjects which can be missed and are amazing.\n\nVery busy during our midweek visit, but the crowds moved well apart from in front of the Van Gogh works, and there are elevators for those less able.', 'time': 1697742615, 'translated': False}, {'author_name': 'Annamae Mckerns', 'author_url': 'https://www.google.com/maps/contrib/104817994165078583956/reviews', 'language': 'en', 'original_language': 'en', 'profile_photo_url': 'https://lh3.googleusercontent.com/a-/ALV-UjU7HCmrrEqMgcmfXwkJMvYC9tAHtVzmhPWg5YTvgLMNZmFi=s128-c0x00000000-cc-rp-mo', 'rating': 5, 'relative_time_description': '3 months ago', 'text': ""I visited the museum of modern art especially to see the Georgia O'Keeffe exhibit and it was fabulous. So were many of the other exhibits and the most fascinating was the wall on the first floor that continued to flow and morph into something different every minute. It was mesmerizing!\nThe museum space itself was well-designed and bright and the outdoor sculpture garden was lovely.\nWhen you visit New York, don't miss this excellent museum."", 'time': 1690374430, 'translated': False}, {'author_name': 'Derek y', 'author_url': 'https://www.google.com/maps/contrib/110324964878887257221/reviews', 'language': 'en', 'original_language': 'en', 'profile_photo_url': 'https://lh3.googleusercontent.com/a/ACg8ocLWN1ruz85BZylmFMfAA9jN_vh3o5NeQd6Y5hnR2fW3=s128-c0x00000000-cc-rp-mo-ba4', 'rating': 5, 'relative_time_description': 'a week ago', 'text': 'I don’t know what else to tell you but art.\nYou’re right in the city center looking at art in a gallery. The pieces are intriguing and there are interactive pieces as well. Sculptures and was art.\n\nStarry night and a fall out shelter example and Warhol were amongst my favourite\n\nThe cafe upstairs is way over priced and you could get better food in my other reviews', 'time': 1697543858, 'translated': False}]",,,4.6,Morning,2-3 hours
Times Square,"Manhattan, NY 10036, USA",40.7579747,-73.9855426,Times Square,"{'language': 'en', 'overview': 'Bustling destination in the heart of the Theater District known for bright lights, shopping & shows.'}","[{'author_name': 'Rachel Bohn', 'author_url': 'https://www.google.com/maps/contrib/108731009421857726077/reviews', 'language': 'en', 'original_language': 'en', 'profile_photo_url': 'https://lh3.googleusercontent.com/a-/ALV-UjWhGpZ_xbA5JSmDjhdGPA8yoYI9AAR0juYRZoKjMGt37YkA=s128-c0x00000000-cc-rp-mo-ba3', 'rating': 5, 'relative_time_description': 'in the last week', 'text': 'This was my very first trip to NY and Times Square, and it was wonderful! Easy to walk around and to see unique personalities and shops! Tuesday seemed like a great day to go! Not too crowded, but it definitely had the NYC feel! I will be returning soon.', 'time': 1698087562, 'translated': False}, {'author_name': 'Tolga', 'author_url': 'https://www.google.com/maps/contrib/104577361986085883494/reviews', 'language': 'en', 'original_language': 'en', 'profile_photo_url': 'https://lh3.googleusercontent.com/a-/ALV-UjXkktitKvIP_fh8iUFKglHsmy4xQ0WMOgOA2bC_wP8J4Ysg=s128-c0x00000000-cc-rp-mo-ba6', 'rating': 4, 'relative_time_description': 'a week ago', 'text': 'Iconic spot of New York City, plethora of people and characters. Still the quality of the square’s design and architecture is missing compared to European squares. Full of hustle and bustle 👯you should be careful not to get hit by a car around.', 'time': 1697770663, 'translated': False}, {'author_name': 'Kanchan Kumar', 'author_url': 'https://www.google.com/maps/contrib/114234612803122168917/reviews', 'language': 'en', 'original_language': 'en', 'profile_photo_url': 'https://lh3.googleusercontent.com/a-/ALV-UjVgQFl5kQVx1yT5REIsm2qcVp3n4wh9pkYm3nHS2yiG0A-9=s128-c0x00000000-cc-rp-mo-ba8', 'rating': 5, 'relative_time_description': '4 weeks ago', 'text': ""It's one of the most happening places in New York City. No matter it rains or shines you'll have a memorable experience visiting this spot. A must visit spot for all visitors of New York, it's well connected by the subway and other public transit like bus and cabs. Getting a parking spot is tricky so commuting on public transport is better."", 'time': 1696175648, 'translated': False}, {'author_name': 'Midas Mulligan', 'author_url': 'https://www.google.com/maps/contrib/108522762642870310992/reviews', 'language': 'en', 'original_language': 'en', 'profile_photo_url': 'https://lh3.googleusercontent.com/a-/ALV-UjVLanTCmxhD28ir7lu8e4LBmfDyrgY4zLOFcQtjkRcwtzE=s128-c0x00000000-cc-rp-mo-ba3', 'rating': 5, 'relative_time_description': 'in the last week', 'text': 'I love NY. It was an amazing experience. Ground Zero I would definitely recommend. It’s hard not to cry. All the historical landmarks makes a dream come true. I’m a country boy at heart. Now I’ve feel in love with Big lights. To be here. It’s like being in the center of the Universe.', 'time': 1698148133, 'translated': False}, {'author_name': 'Stevie Gill', 'author_url': 'https://www.google.com/maps/contrib/116211061557960592542/reviews', 'language': 'en', 'original_language': 'en', 'profile_photo_url': 'https://lh3.googleusercontent.com/a/ACg8ocK-GUUn3UvXa4Yj4d_Qebp7nXfbfYuIp84ackRATrLfVA=s128-c0x00000000-cc-rp-mo-ba4', 'rating': 5, 'relative_time_description': 'a week ago', 'text': 'Excellent vibrant location day and night. Basically, as more happening Leicester Square. Lots of shops, restaurants etc... Safe to walk down and near tube stations. We stayed at the Manhattan Club hotel which was a 5 minute walk from Time Square. Lots of bright TV screens advertising big brands and amazing location for Instagram pics. Highly recommended a visit.', 'time': 1697672522, 'translated': False}]",,,4.7,Evening,1-2 hours
Grand Central Terminal,"89 E 42nd St, New York, NY 10017, USA",40.75272619999999,-73.9772294,Grand Central Terminal,"{'language': 'en', 'overview': 'Iconic train station known for its grand facade & main concourse, also offering shops & dining.'}","[{'author_name': 'PureNRG2002', 'author_url': 'https://www.google.com/maps/contrib/100330127676185668008/reviews', 'language': 'en', 'original_language': 'en', 'profile_photo_url': 'https://lh3.googleusercontent.com/a-/ALV-UjXpmdnjFjuq44iWI1CBLm35L4DkLnDJQxrdAtf_7wWHvA=s128-c0x00000000-cc-rp-mo-ba6', 'rating': 5, 'relative_time_description': 'in the last week', 'text': 'On screen, you\'ve seen Grand Central Terminal in dozens (if not hundreds) of movies & TV appearances. But seeing this historical building in person is well worth a visit. I love the soaring, vaulted ceilings with the starry constellation painted above. And the (reportedly) $20 million opal glass clock sitting quietly atop the circular Information Booth. And the marble staircases, and the chandeliers, and the kinetic energy of scurrying commuters coming & going. New York really knows how to put the ""Grand"" into their ""Central Terminal""!', 'time': 1698440738, 'translated': False}, {'author_name': 'Charlie', 'author_url': 'https://www.google.com/maps/contrib/110091488706273592914/reviews', 'language': 'en', 'original_language': 'en', 'profile_photo_url': 'https://lh3.googleusercontent.com/a-/ALV-UjVJKPMyhRZB606lZ0YGXBoTubEB8QGoxcc-0VlsL38C7Fk=s128-c0x00000000-cc-rp-mo-ba6', 'rating': 5, 'relative_time_description': 'in the last week', 'text': 'Grand Central Station, is a historic train station located in Midtown Manhattan, New York City. It is renowned for its magnificent Beaux-Arts architecture, including a grand main concourse with a celestial-themed ceiling adorned with constellations. Opened in 1913, it serves as a major transportation hub connecting commuters and travelers via Metro-North Railroad to suburban areas in New York and Connecticut. Grand Central Terminal is not just a transit hub; it also houses restaurants, shops, and exhibits, making it a vibrant cultural and architectural landmark in the heart of the city.', 'time': 1698409791, 'translated': False}, {'author_name': 'Gioconda Vidal', 'author_url': 'https://www.google.com/maps/contrib/109859026783413804437/reviews', 'language': 'en', 'original_language': 'en', 'profile_photo_url': 'https://lh3.googleusercontent.com/a-/ALV-UjVaPSyMunIzXqhUmzhTNFgU2GYHNzipnoOwGy7bj1ZiMc5j=s128-c0x00000000-cc-rp-mo-ba5', 'rating': 5, 'relative_time_description': '2 weeks ago', 'text': ""Grand Central Station is a magnificent work of art in every single way. The moment you enter, you feel like you've been transported to a different place, the elegance of the walls and its architecture, the mesmerizing beautiful celestial ceiling alone is worth of an exhibition in a museum. The Iconic brass clock in the middle of the station by the ticket sales, seen on hundreds of movies, it's exactly as shiny and small as we all have seen it in the big screen. The impeccable cleaninnes of this place deserves a 5 stars and the courteous, professional and welcoming approach from the station staff, officers and everybody else is the ice on the cake, it makes this visit one of the most pleasant in the city.\nDefinitely, Grand Central is a must if you are visiting🗽💯 💟"", 'time': 1697162012, 'translated': False}, {'author_name': 'Kytka', 'author_url': 'https://www.google.com/maps/contrib/102555502680995447791/reviews', 'language': 'en', 'original_language': 'en', 'profile_photo_url': 'https://lh3.googleusercontent.com/a-/ALV-UjVb4smW_dhwlDAaUQqY3RqDtLyludgekKoreuyElZ2y0_mb=s128-c0x00000000-cc-rp-mo-ba5', 'rating': 5, 'relative_time_description': 'a month ago', 'text': ""Grand Central Terminal is an absolute marvel and a must-visit destination for anyone exploring New York City. As a visitor, my experience there was nothing short of awe-inspiring.\n\nFrom the moment I entered, I was captivated by the grandeur of the terminal. Its Beaux-Arts architecture, characterized by its iconic celestial-themed ceiling, elegant chandeliers, and intricate details, creates an atmosphere of timeless elegance. It's not just a transportation hub; it's a living work of art.\n\nNavigating the terminal was surprisingly easy, thanks to clear signage and helpful staff. It's the gateway to the city and beyond, with its extensive network of trains and subways connecting you to various neighborhoods and attractions.\n\nThe dining options inside the terminal are exceptional, from casual eateries to upscale restaurants. Whether you're grabbing a quick bite or enjoying a leisurely meal, there's something for every palate.\n\nWhat truly impressed me was the Vanderbilt Hall, a magnificent space often used for exhibitions and events. It's a testament to the terminal's versatility and its role as a cultural hub.\n\nOverall, Grand Central Terminal is a quintessential New York City experience. It's a place where history, art, and transportation converge, and it left me with a deep appreciation for the city's grandeur and sophistication. A visit to Grand Central Terminal is a journey through time and architecture, making it an unforgettable part of any New York City adventure."", 'time': 1694652114, 'translated': False}, {'author_name': 'Muneerah', 'author_url': 'https://www.google.com/maps/contrib/110544904150720816198/reviews', 'language': 'en', 'original_language': 'en', 'profile_photo_url': 'https://lh3.googleusercontent.com/a-/ALV-UjUMDRXZ7JWjXPsja-Z2nNGW2HmOdXWKEdkJC0GWW0m6W8U0=s128-c0x00000000-cc-rp-mo-ba5', 'rating': 5, 'relative_time_description': '2 months ago', 'text': ""This is not my first visit 😍😍Grand Central Terminal in New York stands as an architectural marvel, its iconic celestial ceiling and opulent interiors evoking a sense of timeless elegance. Serving as both a bustling transportation hub and a cultural landmark, it encapsulates the city's vibrant energy and rich history. It is a must !!!"", 'time': 1691902234, 'translated': False}]",,2,4.7,Morning or Afternoon,1 hour
Bryant Park,"New York, NY 10018, USA",40.7535965,-73.9832326,Bryant Park,"{'language': 'en', 'overview': ""Green space behind the NY Public Library's main branch, with 4 acres, a cafe and other food kiosks.""}","[{'author_name': 'Andy Jenkins', 'author_url': 'https://www.google.com/maps/contrib/103160999552328578883/reviews', 'language': 'en', 'original_language': 'en', 'profile_photo_url': 'https://lh3.googleusercontent.com/a-/ALV-UjX4gi9Jf-nNBAXDOnfvXW-phojsPS4YI-lb2nVu4Lw_FzX_=s128-c0x00000000-cc-rp-mo-ba5', 'rating': 5, 'relative_time_description': 'a week ago', 'text': ""This is a park that surrounds the exterior of the New York Public Library. It's a great place to sit and we did on several mornings of our holiday when we grabbed breakfast. It's clean and had loads of chairs and tables available so there should usually be a place to sit.\nGreat for people or traffic watching."", 'time': 1697742312, 'translated': False}, {'author_name': 'Keyur Thakkar', 'author_url': 'https://www.google.com/maps/contrib/113729545782425920830/reviews', 'language': 'en', 'original_language': 'en', 'profile_photo_url': 'https://lh3.googleusercontent.com/a-/ALV-UjW2wPDpBdmtPk7dHm4KZaFNWxL60q0pbGO2uRdpmvVbVJ8p=s128-c0x00000000-cc-rp-mo-ba6', 'rating': 5, 'relative_time_description': 'a month ago', 'text': ""Bryant Park in New York City is a wonderful place! It's like a calm oasis in the middle of the busy city.\n\nThe park is so pretty with lots of trees, flowers, and a big grassy area where you can just sit and relax. You can read a book there or have a picnic in the sun.\n\nOne great thing about Bryant Park is there's always something fun to do. In the summer, you can join free yoga classes or watch movies outside. In winter, they have a cool ice-skating rink! Plus, they often have live music you can enjoy while sitting on one of the many benches.\n\nThere's a romantic fountain and a carousel that adds to the park's charm. You can grab a coffee from the little stands or check out the craft booths.\n\nOverall, Bryant Park is a fantastic spot for everyone."", 'time': 1694832540, 'translated': False}, {'author_name': 'Ben Park', 'author_url': 'https://www.google.com/maps/contrib/117236455949555586480/reviews', 'language': 'en', 'original_language': 'en', 'profile_photo_url': 'https://lh3.googleusercontent.com/a/ACg8ocIF6cO1wLUrYCoXSZcRFHgZQUzUQ4FmL5Zu4FdYcbaZ2IM=s128-c0x00000000-cc-rp-mo-ba4', 'rating': 5, 'relative_time_description': '3 weeks ago', 'text': 'Every time I’m in NYC I try to visit Bryant Park. It’s one of the very few places in midtown that feels calm. It’s touristy but there are plenty of locals too and it’s easy to find a place to sit and people watch, get a coffee or just stroll around. Even better at night when the buildings around the park give an amazing backdrop.', 'time': 1696802372, 'translated': False}, {'author_name': 'Charlie', 'author_url': 'https://www.google.com/maps/contrib/110091488706273592914/reviews', 'language': 'en', 'original_language': 'en', 'profile_photo_url': 'https://lh3.googleusercontent.com/a-/ALV-UjVJKPMyhRZB606lZ0YGXBoTubEB8QGoxcc-0VlsL38C7Fk=s128-c0x00000000-cc-rp-mo-ba6', 'rating': 5, 'relative_time_description': 'in the last week', 'text': ""Nestled amidst the bustling heart of Manhattan, Bryant Park stands as an oasis of tranquility amid the urban frenzy. This green haven, flanked by towering skyscrapers, invites locals and tourists alike to unwind. Its meticulously manicured lawns, shaded pathways, and vibrant gardens create a serene ambiance, perfect for leisurely strolls or a quiet escape from the city's hustle. Bryant Park hosts a myriad of cultural events, from outdoor movie nights to live performances, adding a touch of artistry to its natural beauty. With its charming ambiance, free Wi-Fi, and seasonal amenities, it has become a beloved retreat for New Yorkers, fostering a sense of community and relaxation in the heart of the metropolis."", 'time': 1698320784, 'translated': False}, {'author_name': 'Pardeep Kumar', 'author_url': 'https://www.google.com/maps/contrib/109307031906765471715/reviews', 'language': 'en', 'original_language': 'en', 'profile_photo_url': 'https://lh3.googleusercontent.com/a-/ALV-UjXaqPRWThp5Qhp9BjIwnq1bc5hJIxD-dcn9_4R-DJWLpA=s128-c0x00000000-cc-rp-mo-ba4', 'rating': 5, 'relative_time_description': '4 weeks ago', 'text': 'Come to Ryan park you always find different activities to do you can come to the ground and do picnic or just go to the front and Whole Food Market buy something to eat and enjoying the park. I came today with my friends and we were eating pasta was fantastic please come and visit', 'time': 1696124097, 'translated': False}]",,,4.7,Afternoon,1-2 hours
The New York Public Library,"476 5th Ave, New York, NY 10018, USA",40.75318230000001,-73.9822534,New York Public Library - Stephen A. Schwarzman Building,"{'language': 'en', 'overview': ""NYC's flagship library, in a beaux arts building next to Bryant Park, flanked by iconic stone lions.""}","[{'author_name': 'Kytka', 'author_url': 'https://www.google.com/maps/contrib/102555502680995447791/reviews', 'language': 'en', 'original_language': 'en', 'profile_photo_url': 'https://lh3.googleusercontent.com/a-/ALV-UjVb4smW_dhwlDAaUQqY3RqDtLyludgekKoreuyElZ2y0_mb=s128-c0x00000000-cc-rp-mo-ba5', 'rating': 5, 'relative_time_description': 'a month ago', 'text': ""The New York Public Library is an absolute treasure for book lovers and history enthusiasts alike. As a visitor, I was in awe of the library's majestic architecture, with its iconic lion statues guarding the entrance. Inside, the grandeur continued, with vast reading rooms, historic manuscripts, and an incredible collection of books from every genre imaginable.\n\nBeyond its literary treasures, the library also serves as a haven for those seeking a quiet and contemplative space in the midst of bustling Manhattan. Whether you're doing research, reading, or simply exploring the grand halls, the New York Public Library offers a sense of serenity in the heart of the city.\n\nWhat struck me most during my visit was the palpable sense of history that permeates the library's halls. It's not just a repository of books; it's a repository of knowledge, culture, and the collective memory of a city and a nation. It's a place where the past and present coexist harmoniously.\n\nI highly recommend a visit to the New York Public Library, not only for its literary treasures but also for the profound sense of history and culture it imparts to all who enter its doors. It's a true gem in the cultural tapestry of New York City."", 'time': 1694661607, 'translated': False}, {'author_name': 'PureNRG2002', 'author_url': 'https://www.google.com/maps/contrib/100330127676185668008/reviews', 'language': 'en', 'original_language': 'en', 'profile_photo_url': 'https://lh3.googleusercontent.com/a-/ALV-UjXpmdnjFjuq44iWI1CBLm35L4DkLnDJQxrdAtf_7wWHvA=s128-c0x00000000-cc-rp-mo-ba6', 'rating': 5, 'relative_time_description': 'in the last week', 'text': ""Guess what offers (1) FREE admission; (2) Knowledgeable tour guides (also free); (3) stunning architecture & art work; (4) a tranquil place for research & study; and (5) historical one-of-a-kind maps, periodicals & books (including some of Shakespeare's First Folios & the 1st printing of the King James Bible, 1611)? That's right, the New York Public Library and its flagship Schwarzman Building. So glad I added this stop to my brief New York City visit. // BONUS: Right behind the library is Bryant Park, a large green space to relax, grab a bite, or to socialize."", 'time': 1698439110, 'translated': False}, {'author_name': 'Banu B', 'author_url': 'https://www.google.com/maps/contrib/100438285651904529209/reviews', 'language': 'en', 'original_language': 'en', 'profile_photo_url': 'https://lh3.googleusercontent.com/a-/ALV-UjWkmeUE5BozRCl3xrXzZvW0OHpXGNoKasAftnrM1drn7g=s128-c0x00000000-cc-rp-mo-ba4', 'rating': 5, 'relative_time_description': '2 months ago', 'text': 'It has a peaceful environment, the employees are very helpful.  The building smells of history, the huge walls and the artwork on the walls are a visual feast.  I was very happy to be there.  Your bag is searched at the door, food and drink are not accepted.  There are suitable places in the library for you to work in conjunction with the intensity.  They require reservations for some halls. Must visit!', 'time': 1691766351, 'translated': False}, {'author_name': 'Ashley H', 'author_url': 'https://www.google.com/maps/contrib/105733116724535045679/reviews', 'language': 'en', 'original_language': 'en', 'profile_photo_url': 'https://lh3.googleusercontent.com/a-/ALV-UjXOBrMa2gDF-0AYHaKmrznoLJaBv5_tOpZhPNO3_e_bOmuX=s128-c0x00000000-cc-rp-mo-ba6', 'rating': 5, 'relative_time_description': '3 months ago', 'text': 'The New York Public Library is fantastic to visit from beginning to end. The architecture alone is amazing, inside and out. The majestic steps leading to the pillars at the entrance are beautiful. There is always a free exhibit open to the public with rotating items and features. There is also a gift shop and library cafe. There are also quiet rooms to study or work. As a tourist, I’d plan at least an hour at this library. They do a bag check upon entry and exit, no food or drinks allowed.', 'time': 1690330283, 'translated': False}, {'author_name': 'Robert Reynolds', 'author_url': 'https://www.google.com/maps/contrib/101520772560313128580/reviews', 'language': 'en', 'original_language': 'en', 'profile_photo_url': 'https://lh3.googleusercontent.com/a-/ALV-UjX7FBHTSGWF4k365_77GtJQvSg6PcXEa5qZXjrIss0G3og=s128-c0x00000000-cc-rp-mo-ba5', 'rating': 5, 'relative_time_description': '2 months ago', 'text': 'Very cool to visit and walk around. The architecture is quite amazing to look at. This place is more museum than library. I didn’t see a lot of books. There was a gift shop with really nice gift options. We got a few things there. Also there was a room that really was like a museum (free to enter) with display cases of old books and antiques and art. Very cool.', 'time': 1692549124, 'translated': False}]",,0,4.7,Morning or Afternoon,1-2 hours
