place_name,address,latitude,longitude,name,editorial_summary,reviews,type,price_level,rating,best_time_to_visit,average_duration_to_spend
The National 9/11 Memorial & Museum,"180 Greenwich St, New York, NY 10007, USA",40.7115776,-74.0133362,9/11 Memorial & Museum,"{'language': 'en', 'overview': 'Plaza, pools & exhibits honoring victims of 1993 & 2001 WTC terrorist attacks. Free timed admission.'}","[{'author_name': 'Cindy Rinaldi', 'author_url': 'https://www.google.com/maps/contrib/104951297013022043327/reviews', 'language': 'en', 'original_language': 'en', 'profile_photo_url': 'https://lh3.googleusercontent.com/a-/ALV-UjV0mGBO1895IvwsXWwpu_3QS5Kpy06s_LOL6u_M4i1RoZk=s128-c0x00000000-cc-rp-mo-ba4', 'rating': 5, 'relative_time_description': 'a week ago', 'text': 'I didn’t expect to be brought to tears over most of the displays. Especially the room where families are saying the name of who died and a short story about them.\n\nThank goodness someone had the foresight to save all the artifacts. The museum is beautifully setup.\n\nI highly recommend going through the museum.\n\nTake the train. It drops you right at the museum. DO NOT drive. Parking was terrible.', 'time': 1697719532, 'translated': False}, {'author_name': 'T. Lomax', 'author_url': 'https://www.google.com/maps/contrib/101269423515653735814/reviews', 'language': 'en', 'original_language': 'en', 'profile_photo_url': 'https://lh3.googleusercontent.com/a/ACg8ocLAn9wRKRqJgJvCetDZZJKNF7DidI3HD3xPrDhiacNR86s=s128-c0x00000000-cc-rp-mo-ba3', 'rating': 5, 'relative_time_description': 'in the last week', 'text': 'If you purchase tickets from Tickets at Work - DO NOT stand in the long line. You can immediately go inside. I may have said “ticket voucher” so I had to stand in line unfortunately. Really beautiful museum but hard to process what happened there so, for some, be prepared to feel a bit somber or maybe even overwhelmed. Also, please be respectful of when pictures are NOT allowed in the memorial. The gift shop is nice with items to help the museum stay open. The outside fountains are a great tribute.', 'time': 1698158980, 'translated': False}, {'author_name': 'Austin Carson', 'author_url': 'https://www.google.com/maps/contrib/118240383996400933125/reviews', 'language': 'en', 'original_language': 'en', 'profile_photo_url': 'https://lh3.googleusercontent.com/a-/ALV-UjXtccbrrM03MsH6P7Wz6oEUnQFXrE2nD2WL59KBTInnY08=s128-c0x00000000-cc-rp-mo-ba4', 'rating': 5, 'relative_time_description': 'a week ago', 'text': ""Words can not describe how amazing this Museum is. It's haunting to walk on the grounds of the attacks, to see the actual remains of some of the towers, to see parts of the actual planes themselves. Some of the audio recordings you can listen to around the museum are chilling. It's hard not to get emotional walking around parts of the Museum honestly. A good portion doesn't allow photos, which is fine, it just makes it that much more special to be there."", 'time': 1697860775, 'translated': False}, {'author_name': 'Missy Rhodes', 'author_url': 'https://www.google.com/maps/contrib/100672041044413606749/reviews', 'language': 'en', 'original_language': 'en', 'profile_photo_url': 'https://lh3.googleusercontent.com/a-/ALV-UjXP8MYxNCarsnSijILT1e4Z-mCQ49-PtPVvnyjfcddC-sM=s128-c0x00000000-cc-rp-mo-ba5', 'rating': 5, 'relative_time_description': 'in the last week', 'text': ""It's hard to find words to describe the experience. It's terrible that the new tower and museum exists rather than what was originally there. 9/11 is one of those days you cannot possibly forget, I certainly won't. Those that were tasked with the impossible job of designing and creating the fountains, museum, and tower deserve high praise as I feel they did an incredible job with a beyond difficult task. Although very difficult to see some of it, it is a must see. The museum was beautiful, and staff wonderful."", 'time': 1698324572, 'translated': False}, {'author_name': 'Alicia Parnell', 'author_url': 'https://www.google.com/maps/contrib/113329342730314940496/reviews', 'language': 'en', 'original_language': 'en', 'profile_photo_url': 'https://lh3.googleusercontent.com/a-/ALV-UjUurQpxKI_2jH8SQzD8I9AZ8YXOYR2m-L8qFNZyNCfbbacj=s128-c0x00000000-cc-rp-mo-ba4', 'rating': 5, 'relative_time_description': 'a month ago', 'text': 'Beautiful and amazing experience. Simplicity that makes this museum and monument memorable for those who were around when 9/11 occurred and poignant for those who are learning what we saw unfold across the World and in every American classroom.\n\nWe bought our tickets in advance and had the opening time. The museum was empty and allowed for great shots of the vastness that use to be the twin towers. Shortly after we entered the floor became busy. No matter the time you come - it is worth it.', 'time': 1694653149, 'translated': False}]",,,4.8,Morning,2-3 hours
The Metropolitan Museum of Art,"1000 5th Ave, New York, NY 10028, USA",40.7794366,-73.963244,The Metropolitan Museum of Art,"{'language': 'en', 'overview': ""A grand setting for one of the world's greatest collections of art, from ancient to contemporary.""}","[{'author_name': 'Kevin Ao', 'author_url': 'https://www.google.com/maps/contrib/109020333560094376374/reviews', 'language': 'en', 'original_language': 'en', 'profile_photo_url': 'https://lh3.googleusercontent.com/a-/ALV-UjURxrVwd_miXPB1-d8wFJFhItOk0rVszKZ7kd6GoaokaL4=s128-c0x00000000-cc-rp-mo-ba6', 'rating': 4, 'relative_time_description': 'in the last week', 'text': ""I recently visited The Metropolitan Museum of Art and it's definitely the largest museum I have ever seen. The sheer size of the museum (2 million square feet!) can be overwhelming, so I definitely recommend doing your research before you go and knowing what you want to see. You will need multiple visits to appreciate everything the museum has to offer. I enjoyed the arms and armor section, but unfortunately didn't get a chance to explore the rest of the museum."", 'time': 1698172572, 'translated': False}, {'author_name': 'Syl', 'author_url': 'https://www.google.com/maps/contrib/102442018301307748695/reviews', 'language': 'en', 'original_language': 'en', 'profile_photo_url': 'https://lh3.googleusercontent.com/a/ACg8ocIKvfiqhDqB2XK-cmNEuHODDq_P8WERwbOaxg-ShEFD=s128-c0x00000000-cc-rp-mo-ba4', 'rating': 5, 'relative_time_description': 'a month ago', 'text': 'Beautiful museum! So much to learn about! Amazing to see part of these 5000 years of global history and art regrouped in a single place.\nI loved the Greek & Roman Art, and I was specially moved by the ""Artists of the Holocaust"" exhibition (April - Sept 2023). One can also learn more about the American art (American Wing). All the exhibitions are tempting, and one day is certainly not enough to visit it all fully!\nBesides the exhibitions, the Museum itself is beautiful, spacious, clean & the staff is more than friendly to share recommendations and tips.\nLoved this visit, a must to everyone passing by NY!', 'time': 1693832500, 'translated': False}, {'author_name': 'Erin Han', 'author_url': 'https://www.google.com/maps/contrib/110470181243144102491/reviews', 'language': 'en', 'original_language': 'en', 'profile_photo_url': 'https://lh3.googleusercontent.com/a-/ALV-UjWgiexYV3DtIfRxNcGuKUX2Q_pzMbcZ3rV2ajP7t4bj8Q=s128-c0x00000000-cc-rp-mo-ba3', 'rating': 4, 'relative_time_description': 'a week ago', 'text': 'This is my 2nd visit to the Met. It was still a great experience, but the collection was limited due to the closure of some galleries. Make sure to get the map and plan it out for your convenience. Or you will miss a lot. By far, it is one of the best art museums I’ve been to. I will visit again when the European art gallery opens back up!', 'time': 1697485434, 'translated': False}, {'author_name': 'Pradyumna Shome', 'author_url': 'https://www.google.com/maps/contrib/115974151588941654440/reviews', 'language': 'en', 'original_language': 'en', 'profile_photo_url': 'https://lh3.googleusercontent.com/a-/ALV-UjWe2aMMhpPzCSDjyj_FDg79KmPPEIFEluR0jPqiTCG3A7U=s128-c0x00000000-cc-rp-mo-ba3', 'rating': 5, 'relative_time_description': 'a year ago', 'text': 'Amazing experience. There are so many interesting stories and conversations told by the art here. I highly recommend getting a private tour to truly be able to appreciate everything that is on display. You cannot hope to see everything in one visit so it’s worth planning the sections/periods you’re most interested in and prioritizing them in the time you have.', 'time': 1657156304, 'translated': False}, {'author_name': 'Just L', 'author_url': 'https://www.google.com/maps/contrib/106204164199810436703/reviews', 'language': 'en', 'original_language': 'en', 'profile_photo_url': 'https://lh3.googleusercontent.com/a-/ALV-UjXf6L1IeJTSU5I85GhRTD7flnwNaD1cn40AVrxoqHHKyw=s128-c0x00000000-cc-rp-mo-ba2', 'rating': 5, 'relative_time_description': 'in the last week', 'text': 'If you can split your visit in two days it would be good! I can be draining and overwhelming to finish the whole museum. I recommend you do first floor first then second day second floor. Over all enjoy the museum! It’s for all of us to see', 'time': 1698441445, 'translated': False}]",,3,4.8,Morning,3-4 hours
Central Park,"New York, NY, USA",40.7825547,-73.9655834,Central Park,"{'language': 'en', 'overview': 'Sprawling park with pedestrian paths & ballfields, plus a zoo, carousel, boat rentals & a reservoir.'}","[{'author_name': 'Adriana Larotta', 'author_url': 'https://www.google.com/maps/contrib/108722917193483970166/reviews', 'language': 'en', 'original_language': 'en', 'profile_photo_url': 'https://lh3.googleusercontent.com/a-/ALV-UjV7BWKDRi9yb4OQiyFjTdkEJqzXeKYck4AgrmireCp-_oDu=s128-c0x00000000-cc-rp-mo-ba6', 'rating': 5, 'relative_time_description': 'in the last week', 'text': ""Central Park is an absolute gem, and I love this place. If I ever return to New York, it's a spot I'd revisit, no matter how many times I've been. It's a destination that's always worth the visit.\n\nOne of the best plans is to explore it from one end to the other. I once walked from the north to the south, taking around three to four hours, with breaks for photos. I highly recommend trying out the new app they have, which provides a fascinating way to enhance your experience. It offers insights into the history and significance of specific points within Central Park, enriching your visit.\n\nWhat I appreciate about Central Park is that it's a sanctuary of calm amidst the bustling city. When I visited, it was relatively uncrowded, with people jogging and families strolling. It's a refreshing escape from the usual city chaos. There are so many fantastic spots to discover; I couldn't even see them all on my last visit.\n\nYou can explore on foot, or even rent a Citibank bike to cover more ground. Regardless of how you choose to explore, Central Park is a must-visit. It's a fantastic, free activity that's an integral part of any New York trip."", 'time': 1698524292, 'translated': False}, {'author_name': 'Martin Franz', 'author_url': 'https://www.google.com/maps/contrib/116346174642245592279/reviews', 'language': 'en', 'original_language': 'en', 'profile_photo_url': 'https://lh3.googleusercontent.com/a-/ALV-UjVto7pDpBWm3_VvYyfUzagHBCsMVF7j4Lk1Neau1Klk2Os=s128-c0x00000000-cc-rp-mo-ba4', 'rating': 5, 'relative_time_description': 'a week ago', 'text': 'Loved it there. Rent a bike (2h when you just want to cycle through the park, otherwise you’ll need more time) and walk there and relax. Didn’t expect it to be that nice and calm. Views are amazing see the skyscrapers all over in the background', 'time': 1697621127, 'translated': False}, {'author_name': 'Kalu Thapa', 'author_url': 'https://www.google.com/maps/contrib/111714149788703984183/reviews', 'language': 'en', 'original_language': 'en', 'profile_photo_url': 'https://lh3.googleusercontent.com/a-/ALV-UjX8yMkjGP9uBv-y8L1H27ey-bnr3oLdzDMFl73F_Ry7n5Ug=s128-c0x00000000-cc-rp-mo-ba4', 'rating': 5, 'relative_time_description': 'a week ago', 'text': 'Central Park\xa0is located at the neighborhoods of\xa0Manhattan in New York City. It is the\xa0fifth largest park in the city, containing 843 acres (341\xa0ha), and the most visited urban park in the United States, with an estimated 42\xa0million visitors annually as of 2016. Horse carriage and pedicab tour including guide is available here. Great for walking and jogging through east and west Drive loop.', 'time': 1697494402, 'translated': False}, {'author_name': 'Andy Jenkins', 'author_url': 'https://www.google.com/maps/contrib/103160999552328578883/reviews', 'language': 'en', 'original_language': 'en', 'profile_photo_url': 'https://lh3.googleusercontent.com/a-/ALV-UjX4gi9Jf-nNBAXDOnfvXW-phojsPS4YI-lb2nVu4Lw_FzX_=s128-c0x00000000-cc-rp-mo-ba5', 'rating': 5, 'relative_time_description': 'a week ago', 'text': 'Want to get away from the noise and intensity of NYC? We spent most of the day strolling through the park, and there is plenty to see and places to relax.\n\nThe park attendant volunteers are fantastic and one of them gave us a free map and marked it up with the kind of attractions we wanted to see.', 'time': 1697742430, 'translated': False}, {'author_name': 'Austin Carson', 'author_url': 'https://www.google.com/maps/contrib/118240383996400933125/reviews', 'language': 'en', 'original_language': 'en', 'profile_photo_url': 'https://lh3.googleusercontent.com/a-/ALV-UjXtccbrrM03MsH6P7Wz6oEUnQFXrE2nD2WL59KBTInnY08=s128-c0x00000000-cc-rp-mo-ba4', 'rating': 5, 'relative_time_description': 'a week ago', 'text': 'Growing up in the country, I\'ll never quite get used to ""parks"" being in cities. Regardless Central Park is big enough to break my view of that stereotype I have. I\'d say the best way to travel around, if you\'re a tourist, is by a bike. There\'s many lovely views to see. I didn\'t realize before visiting though that the park is full of Statues, I\'ll be honest I thought it was mostly about nature beforehand.', 'time': 1697680507, 'translated': False}]",,,4.8,Morning or Afternoon,2-4 hours
Statue of Liberty National Monument,"New York, NY 10004, USA",40.6892494,-74.04450039999999,Statue of Liberty,"{'language': 'en', 'overview': 'Iconic National Monument opened in 1886, offering guided tours & a museum, plus harbor & city views.'}","[{'author_name': 'PureNRG2002', 'author_url': 'https://www.google.com/maps/contrib/100330127676185668008/reviews', 'language': 'en', 'original_language': 'en', 'profile_photo_url': 'https://lh3.googleusercontent.com/a-/ALV-UjXpmdnjFjuq44iWI1CBLm35L4DkLnDJQxrdAtf_7wWHvA=s128-c0x00000000-cc-rp-mo-ba6', 'rating': 5, 'relative_time_description': 'in the last week', 'text': ""Visiting the Statue of Liberty was on my must-see bucket list. Glad I visited this one time (I even climbed all 539 steps from ground level up to the cramped crown.) TIP 1: Access to the Crown is limited to 300 visitors per day on a timed ticket. So reserve your ticket far in advance (I reserved 2 months out). TIP 2: Bring a quarter to use a storage locker for your bag, purse, backpack. (None allowed inside the Statue of Liberty). TIP 3: The Crown is very small, allowing only a handful of guests at a time, after climbing a steep, winding staircase. The views are not that impressive. Honestly, the views from the open-air Pedestal are MUCH better. Next time, I would just visit the Pedestal observation deck. // Liberty Island, upon which the Statue is located, is immaculate, nicely landscaped, and run by the U.S. National Park Service. Take a peek inside the museum on Liberty Island, it's worth a look!"", 'time': 1698435530, 'translated': False}, {'author_name': 'Tony Apperson', 'author_url': 'https://www.google.com/maps/contrib/101923914749601897694/reviews', 'language': 'en', 'original_language': 'en', 'profile_photo_url': 'https://lh3.googleusercontent.com/a/ACg8ocKOrsJMp8eETkW7wkYAzlkPSsAF93_OHnrkywIWfzoj=s128-c0x00000000-cc-rp-mo-ba7', 'rating': 4, 'relative_time_description': 'in the last week', 'text': ""We unfortunately only got to see the Statue Of Liberty from across the water, but it still was pretty cool. It was moving into the evening by the time we got here so we didn't get to set up a trip to get close plus it had been raining all day. The area here in lower Manhattan was super cool though and gave off its own experience, and there is literally a subway right there you can take pretty much anywhere in New York. Sometimes you may have to jump on several different subways depending on where you are going. I would for sure say check this place out whether you can hope on the boat to get closer or not!"", 'time': 1698535428, 'translated': False}, {'author_name': 'Hikmat Khan', 'author_url': 'https://www.google.com/maps/contrib/114165433616618787054/reviews', 'language': 'en', 'original_language': 'en', 'profile_photo_url': 'https://lh3.googleusercontent.com/a/ACg8ocLJJalLgeuffKo0H3LlVD-Gc79_JZZ7m5c_4X8Ste7O=s128-c0x00000000-cc-rp-mo-ba5', 'rating': 5, 'relative_time_description': 'a week ago', 'text': ""Status of Liberty is the perfect choice for a family trip. Our visit to Ellis Island was not only enjoyable but also incredibly informative about the historical facts of immigrants' arrival in the USA. The platform made planning our trip a breeze, and we had an unforgettable experience exploring these iconic landmarks. Highly recommended for a memorable family outing!"", 'time': 1697643989, 'translated': False}, {'author_name': 'Nelisa zuluaga', 'author_url': 'https://www.google.com/maps/contrib/109509398711593833680/reviews', 'language': 'en', 'original_language': 'en', 'profile_photo_url': 'https://lh3.googleusercontent.com/a/ACg8ocJOgbFKl9oocPtXQp8N7yzzNPlGOmHyBV_qDwn_SRNo=s128-c0x00000000-cc-rp-mo-ba3', 'rating': 5, 'relative_time_description': 'a week ago', 'text': ""No complaints. Very well organized to making waiting times flow. Security staff to enter the statue was super nice. We went in October, so it wasn't crowded, but water was MEGA choppy, so the ferry was really tossing."", 'time': 1697462080, 'translated': False}, {'author_name': 'Melissa Greco', 'author_url': 'https://www.google.com/maps/contrib/101141219220176402097/reviews', 'language': 'en', 'original_language': 'en', 'profile_photo_url': 'https://lh3.googleusercontent.com/a-/ALV-UjW_pRAPyjM6wgZ6oUVBmwd3yEPcngSIJTdMZ6n1g4iHCns=s128-c0x00000000-cc-rp-mo-ba4', 'rating': 5, 'relative_time_description': 'a month ago', 'text': ""So here are my tidbits of info. Park on the New Jersey side because it's easier for traffic purposes and to find parking.\nAlso, pick a day that's not overly hot. There is a museum that is air conditioned and a few stores, but you can't hang out in them forever. Food can be a long line, so be prepared,  but it's tasty and the staff is nice. And, bring a water bottle to stay hydrated.\n\nDo both Ellis Island and the Statue of Liberty (I included a few photos of both). If you want to go up the statue, you need a separate ticket, good health, and no younger kids as it's a climb.\n\nEnjoy both those monumental places and take lots of pictures. Just remember to learn about the details behind both of these places as it's a part of our history."", 'time': 1694322717, 'translated': False}]",,,4.7,Morning,2-3 hours
Top of the Rock,"30 Rockefeller Plaza, New York, NY 10112, USA",40.75934950000001,-73.9794087,Top of The Rock,"{'language': 'en', 'overview': 'Observatory on top of Rockefeller Center, with an ocean-liner style design, offering city views.'}","[{'author_name': 'PureNRG2002', 'author_url': 'https://www.google.com/maps/contrib/100330127676185668008/reviews', 'language': 'en', 'original_language': 'en', 'profile_photo_url': 'https://lh3.googleusercontent.com/a-/ALV-UjXpmdnjFjuq44iWI1CBLm35L4DkLnDJQxrdAtf_7wWHvA=s128-c0x00000000-cc-rp-mo-ba6', 'rating': 3, 'relative_time_description': 'in the last week', 'text': ""There are LOTS of helpful employees here - absolutely important to help guide visitors from ticket check-in to the elevators to the open-air observation deck (crowded) & back down to street level. Great views of the Empire State Building & Central Park. // I reserved tickets for 30 minutes before sunset - so we could view the fiery sun setting against New York's skyline & so we could watch all the buildings' lights come on like sparkling diamonds. We spent about one hour atop the outdoor observation deck. // TIP: You can save several dollars & reserve your tickets with third-party providers (Google to find them), instead of purchasing tickets directly from Top of the Rock's website. Senior-age tickets are also discounted."", 'time': 1698434018, 'translated': False}, {'author_name': 'Natalia Dimitrova', 'author_url': 'https://www.google.com/maps/contrib/102209103917312270089/reviews', 'language': 'en', 'original_language': 'en', 'profile_photo_url': 'https://lh3.googleusercontent.com/a-/ALV-UjVtyGLGbgzh8YHYPbX2enp1WcpQRq3KrkW9ayIsYlHDvq4=s128-c0x00000000-cc-rp-mo-ba4', 'rating': 4, 'relative_time_description': 'a week ago', 'text': ""View from Top of the Rock was magnificent, absolutely stunning! But the place where you watch it from is not that good. It's fully open, and if it's chilly, you are cold. When I went, it wasn't fully constructed, there was a lot of unused place. They can make at least a small souvenir shop at the top or a small bar for drinks. Since there is nothing else to do rather than watching the view, it's overcrowded and it can be a challenge to find yourself a good spot, especially at peak hours from 6pm to 7, 7 30pm. And if you go to the upper side - really windy - so bring a jacket. I got a small cold after being exposed to the cold wind at sunset.\nOh, and it's kinda hard to find where to go in order to go to the Top of the rock - maybe some more signs for better guidance."", 'time': 1697490942, 'translated': False}, {'author_name': 'Cristian Turci', 'author_url': 'https://www.google.com/maps/contrib/107956799574969533972/reviews', 'language': 'en', 'original_language': 'en', 'profile_photo_url': 'https://lh3.googleusercontent.com/a-/ALV-UjXPb__8RKYh6rfdInEGXfAAofANWxoBf2Vg7tOFQ_tumx53=s128-c0x00000000-cc-rp-mo-ba6', 'rating': 3, 'relative_time_description': 'a week ago', 'text': 'Very nice view of the Empire State Building and of Central Park but the quantity of the people inside was Crazy. I think they should regulate more the flux. Was almost impossibile to take a photo in the First row. At the exit we had to wait an entire hour to be able to take elevator and reach street floor due to quantity of people going away', 'time': 1697890807, 'translated': False}, {'author_name': 'Beth K', 'author_url': 'https://www.google.com/maps/contrib/115449455707569347752/reviews', 'language': 'en', 'original_language': 'en', 'profile_photo_url': 'https://lh3.googleusercontent.com/a/ACg8ocLooSpldYn5_HK6-eaePktyFzNe8Grxm1s773Xv75L1=s128-c0x00000000-cc-rp-mo-ba6', 'rating': 5, 'relative_time_description': 'a month ago', 'text': ""Gorgeous views. It is a bit of a pricey experience, but 100% worth it! We visited toward the start of the day and didn't have much of  a wait at all. Security was very smooth and the 360 view was just stunning. There are a couple of different levels so that you can easily get that perfect shot without anyone else in your picture. Definitely would reccomend it!"", 'time': 1694356075, 'translated': False}, {'author_name': 'Juraj Podsklan', 'author_url': 'https://www.google.com/maps/contrib/104163615391058026982/reviews', 'language': 'en', 'original_language': 'en', 'profile_photo_url': 'https://lh3.googleusercontent.com/a-/ALV-UjU1VaM_S8HiSYZrf-wSts0iFdRulhn6ikYv6T--8R_Jdz0M=s128-c0x00000000-cc-rp-mo-ba6', 'rating': 4, 'relative_time_description': 'a month ago', 'text': ""Top of The Rock is still a reasonably popular observation deck, with two open air levels and seemingly not too busy to get to, at least on a weekday.\n\nWe visited in the middle of the day Friday and didn't have to wait more than maybe 5min to get tickets using our pass and that was it, straight up after that more or less.\n\nThe views are nice, although the new skyscrapers to the north block the view of Central Park, so only parts of it are visible.\n\nWorth a visit if you have time to spare and are in the area as you can also look at the Cathedral nearby and Rockefeller building itself."", 'time': 1695515617, 'translated': False}]",,,4.7,Late Afternoon or Evening,1-2 hours
Broadway,"Broadway, New York, NY, USA",40.81241989999999,-73.96053429999999,Broadway,"{'language': 'en', 'overview': 'This 32-mi. street through Manhattan & other boroughs is famed for its Midtown theater district.'}",[],,,,Evening,2-3 hours for a show
