place_name,address,latitude,longitude,name,editorial_summary,reviews,type,price_level,rating,best_time_to_visit,average_duration_to_spend
St. Patrick's Cathedral,"5th Ave, New York, NY 10022, USA",40.7586117,-73.9761953,St. Patrick's Cathedral,"{'language': 'en', 'overview': 'Towering Neo-Gothic church from 1879 with twin spires & storied history opposite Rockefeller Center.'}","[{'author_name': 'ً', 'author_url': 'https://www.google.com/maps/contrib/102042839134924444101/reviews', 'language': 'en', 'original_language': 'en', 'profile_photo_url': 'https://lh3.googleusercontent.com/a-/ALV-UjUAruIPbPkZKg3Az_EYJt0ISQ5BTmeHKmp6otFRbL4Pow=s128-c0x00000000-cc-rp-mo-ba3', 'rating': 5, 'relative_time_description': '2 months ago', 'text': 'Absolutely beautiful. I have a soft spot for stained glass so this church was gorgeous. The atmosphere was great, even if I’m not religious, I still felt like I was connected with god. As a music nerd, the organ playing was amazing as well. Overall, amazing experience and definitely recommended!', 'time': 1691606781, 'translated': False}, {'author_name': 'Omar Gonzalez', 'author_url': 'https://www.google.com/maps/contrib/112895492213023114809/reviews', 'language': 'en', 'original_language': 'en', 'profile_photo_url': 'https://lh3.googleusercontent.com/a-/ALV-UjX6i-R0mxjvJXH_QVEbu5-w3LIQgo5a9-f911H2e7YlodU=s128-c0x00000000-cc-rp-mo-ba4', 'rating': 5, 'relative_time_description': '2 weeks ago', 'text': ""St. Patrick's Cathedral in New York is an architectural masterpiece and a must-visit landmark. Its stunning Neo-Gothic design, intricate stained glass windows, and awe-inspiring interior make it a sanctuary of tranquility amidst the city's hustle and bustle. Whether you're admiring the intricate details or attending a service, the cathedral's grandeur and spiritual ambiance are truly captivating. A true gem in the heart of Manhattan, it's a testament to both faith and the artistry of human craftsmanship."", 'time': 1697447284, 'translated': False}, {'author_name': 'Mindy Schroeder', 'author_url': 'https://www.google.com/maps/contrib/117158920236380513668/reviews', 'language': 'en', 'original_language': 'en', 'profile_photo_url': 'https://lh3.googleusercontent.com/a-/ALV-UjU7sqlU_3MFg9JQY4c30vTCTH1YRYCA6bDazZbrEzLLsyQ=s128-c0x00000000-cc-rp-mo-ba4', 'rating': 5, 'relative_time_description': '2 months ago', 'text': 'Breathtakingly beautiful architecture. There was a service going on when we visited, but we were still allowed to come in and walk around to see the  different worship areas. Gift shop is very small, but has some great stuff such as jewelry, many different types of rosary beads and pouches, holy water bottles, etc. This is a must see if you are in NYC.', 'time': 1692280064, 'translated': False}, {'author_name': 'Denise Grafton', 'author_url': 'https://www.google.com/maps/contrib/100383911567687646645/reviews', 'language': 'en', 'original_language': 'en', 'profile_photo_url': 'https://lh3.googleusercontent.com/a/ACg8ocIIwurpdq70MEltAVi5UcLYnLeWTTPK65tHBuDU2bRl=s128-c0x00000000-cc-rp-mo', 'rating': 5, 'relative_time_description': '2 months ago', 'text': 'The Cathedral is beautiful with the stained glass windows and the pictures so well depicted.  The craftsmanship in the ceiling and on the columns is stunning. All created before laser design and cranes. Enter the sanctuary with appreciation to the caretakers and legacy donors.  Would have loved to hear the pipes of the organ! The entrance is free but donations are greatly appreciated.', 'time': 1693357155, 'translated': False}, {'author_name': 'L C', 'author_url': 'https://www.google.com/maps/contrib/112615732461923507909/reviews', 'language': 'en', 'original_language': 'en', 'profile_photo_url': 'https://lh3.googleusercontent.com/a/ACg8ocIiqAxZU_I1EtlFxX4EhrtHlaSrPahTngWcPYRMaQ2M=s128-c0x00000000-cc-rp-mo-ba5', 'rating': 5, 'relative_time_description': '3 months ago', 'text': ""You can walk in and tour around during the day.  The architecture is fascinating.  Light a candle for someone if you are Catholic. It's quite nice and quiet.  Take time to sit and reflect.  Thought it was interesting that they had QR codes on the back of each pew to donate, for the mass reading or for your mass offering."", 'time': 1689452090, 'translated': False}]",,0,4.8,Morning or Afternoon,1 hour
Fifth Avenue,"5th Ave, New York, NY, USA",40.7744146,-73.9656177,5th Avenue,"{'language': 'en', 'overview': 'One of the most prestigious and expensive streets in the world, popular for designer shopping.'}",[],,,,Afternoon,2-3 hours for shopping
Brooklyn Bridge,"New York, NY 10038, USA",40.7060855,-73.9968643,Brooklyn Bridge,"{'language': 'en', 'overview': 'Beloved, circa-1883 landmark connecting Manhattan & Brooklyn via a unique stone-&-steel design.'}","[{'author_name': 'Nixon Caparas', 'author_url': 'https://www.google.com/maps/contrib/100808288658468888154/reviews', 'language': 'en', 'original_language': 'en', 'profile_photo_url': 'https://lh3.googleusercontent.com/a-/ALV-UjUNVXGvDE7_ahnG5KvuNInAxkmFjB5qrVHD0NFTdKZOUA=s128-c0x00000000-cc-rp-mo-ba5', 'rating': 5, 'relative_time_description': 'in the last week', 'text': ""Strolling Across the Breathtaking Brooklyn Bridge\n\nThe Brooklyn Bridge itself is a true architectural marvel, offering awe-inspiring views of the city. What sets it apart, though, are the rich historical and architecturally stunning surroundings at both ends of the bridge.\n\nWhether you choose to embark on a leisurely walk across the bridge, hop on a ferry to the other side, or simply stand and admire its grandeur, the Brooklyn Bridge will leave you in awe. During our visit, we decided to walk across to Brooklyn and return via ferry. I highly recommend an afternoon walk, especially in time for the enchanting sunset over Manhattan from the Brooklyn side. Our crisp February afternoon stroll was thoroughly enjoyable, with the views proving to be nothing short of spectacular. For photography enthusiasts, the bridge offers a wealth of picture-perfect opportunities. Don't miss out on adding this incredible bridge to your Manhattan itinerary."", 'time': 1698332857, 'translated': False}, {'author_name': 'Denis Comte', 'author_url': 'https://www.google.com/maps/contrib/108727186832327928310/reviews', 'language': 'en', 'original_language': 'en', 'profile_photo_url': 'https://lh3.googleusercontent.com/a-/ALV-UjWZY0Q7mW8VkNgRppy2zDlsQLqG3d30JU_XLRQASZrAsbm8=s128-c0x00000000-cc-rp-mo-ba4', 'rating': 5, 'relative_time_description': 'in the last week', 'text': 'Brooklyn Bridge is undoubtedly a breathtaking marvel and a must-see on any NYC trip. While it tends to get quite crowded with tourists and vendors during the day, an early morning visit offers a more serene experience. As one of the oldest bridges in the US, it holds a rich history. The view of the Manhattan skyline from Brooklyn is truly incredible.', 'time': 1698286012, 'translated': False}, {'author_name': 'Rodrigo Sartori Bogo', 'author_url': 'https://www.google.com/maps/contrib/107719587490200367551/reviews', 'language': 'en', 'original_language': 'en', 'profile_photo_url': 'https://lh3.googleusercontent.com/a-/ALV-UjU46PXhcplRmX7yH3dcQfPg8DXMgmjt6ElB2c9PZ7fylX0=s128-c0x00000000-cc-rp-mo-ba4', 'rating': 5, 'relative_time_description': 'a week ago', 'text': 'Incredible views from Manhattan, Brooklyn and the river. The space for walking is good and the bridge itself is huge and beautiful. The only problems are: too many tourists (it is expected) and the guys with 360 picture stages putting the same Alicia Keys song over and over again.', 'time': 1697692390, 'translated': False}, {'author_name': 'Charlie', 'author_url': 'https://www.google.com/maps/contrib/110091488706273592914/reviews', 'language': 'en', 'original_language': 'en', 'profile_photo_url': 'https://lh3.googleusercontent.com/a-/ALV-UjVJKPMyhRZB606lZ0YGXBoTubEB8QGoxcc-0VlsL38C7Fk=s128-c0x00000000-cc-rp-mo-ba6', 'rating': 5, 'relative_time_description': 'in the last week', 'text': ""The Brooklyn Bridge stands as an architectural masterpiece, spanning the East River with elegant grace and historical significance. Connecting Manhattan and Brooklyn, it symbolizes the unification of these vibrant boroughs, embodying the spirit of New York City. Its iconic Gothic towers and intricate cable patterns create a visual marvel, attracting millions of tourists and locals alike. As a testament to human ingenuity, the bridge's construction in 1883 was a feat ahead of its time, marking a new era in bridge engineering. Walking across its wooden planks, one can feel the pulse of the city beneath, making it not just a bridge but a living, breathing emblem of New York's enduring spirit."", 'time': 1698319605, 'translated': False}, {'author_name': 'Angela Howard', 'author_url': 'https://www.google.com/maps/contrib/116492866510374428991/reviews', 'language': 'en', 'original_language': 'en', 'profile_photo_url': 'https://lh3.googleusercontent.com/a-/ALV-UjV9HT-w9PtgUMmrBs5wZ_MNfPEivc0Yl7Z53wv2PitPNwxB=s128-c0x00000000-cc-rp-mo-ba5', 'rating': 5, 'relative_time_description': 'a week ago', 'text': 'Loved the tour we took. To get the most out of it, do a guided tour. After, head to DUMBO for all the iconic photo opts, then take the ferry up the east river to get back to Midtown. Great views of the east river side of Midtown.', 'time': 1697993873, 'translated': False}]",,,4.8,Morning or Sunset,1 hour
Madison Square Garden,"4 Pennsylvania Plaza, New York, NY 10001, USA",40.7505045,-73.9934387,Madison Square Garden,"{'language': 'en', 'overview': 'Billed as the ""world\'s most famous arena"", this icon hosts pro sports, concerts & other big events.'}","[{'author_name': 'Ny Barber', 'author_url': 'https://www.google.com/maps/contrib/109566311653097236641/reviews', 'language': 'en', 'original_language': 'en', 'profile_photo_url': 'https://lh3.googleusercontent.com/a-/ALV-UjVelOeL9ppcYH_bKQrXBP4nIUakRrifyJd6NGa-oM3KpFDy=s128-c0x00000000-cc-rp-mo-ba6', 'rating': 4, 'relative_time_description': 'a month ago', 'text': 'Wonderful arena to see the Eagles farewell concert!!!!\nFirst time here and I truly enjoyed it. We stayed at The New Yorker and MSG was right down the street and convenient.\nIt appears that there was construction everywhere and congested as usual.\nPlenty of options to enter the building.\nEach floor had a lot of memorabilia that showcased wonderful memories. Everyone who touched our soul from music to sports.\nThere are escalators going to each floor. I’m not sure where the elevators were but I’m positive it’s wheelchair accessible to get anyone to where they need to go.\nOne thing that was annoying is that at the end of the concert, there was so much congestion to get to the escalator. I’m sure this is how it always is during any event at any location unfortunately.\nThe arena is equipped with a lot of food vendors and gift stands. They had a lot of different options of food if you’re a picky eater. Drink stands were abundant as well.\nPrices are the standard for any event and being at an arena.\nRestrooms were spaces enough to provide options as where your seats are. The lavatories were nicely maintained and stocked. Unfortunately they do not provide toilet seat covers.\nStaff were professional and courteous. Assisted us with finding our seats.\nThey do not have seat side service.\nThe arena seating was very comfortable me but for the average person it might be a little tight and I’m only 5’2 and 115lbs.\nThe view from our seats were not the best but still had a good view from the wide screen.\nThe arena had a great sound system that provided such a memorable music experience. Usually some places don’t have a great sound system and when someone spoke it just echoed or distorted.\nCleanliness overall was above par.\nOverall experience - my husband and I loved seeing the Eagles and they did a fantastic job performing. MSG made it even more memorable by providing such a great platform for them.', 'time': 1694809240, 'translated': False}, {'author_name': 'Jesse Lucatino', 'author_url': 'https://www.google.com/maps/contrib/111211667048871085717/reviews', 'language': 'en', 'original_language': 'en', 'profile_photo_url': 'https://lh3.googleusercontent.com/a-/ALV-UjX969_VIwdaIqPQFxjvII4B5qTPJ_Pt7eMaFt9DWgVwBNk=s128-c0x00000000-cc-rp-mo-ba4', 'rating': 5, 'relative_time_description': 'a week ago', 'text': ""This is my 4th time as MSG and I have never had a bad time. While the vendor pricing is what is expected for an event, I'd always love to see those prices go down. The area is clean. The seats are a bit on the smaller side, but expected for the venue type.  The sound was great for every concert I've attended. The stage is versatile, as I've seen it from multiple angles for different artists and it's been a good experience each time."", 'time': 1697470328, 'translated': False}, {'author_name': 'Adin Triolo', 'author_url': 'https://www.google.com/maps/contrib/105813341124753357967/reviews', 'language': 'en', 'original_language': 'en', 'profile_photo_url': 'https://lh3.googleusercontent.com/a-/ALV-UjXm9ARqGzIR3gC48udVnZBZkRlwT8uqUt9Ha2T9ORRbPaw=s128-c0x00000000-cc-rp-mo-ba4', 'rating': 5, 'relative_time_description': '2 months ago', 'text': ""Madison Square Garden is a true gem. The venue's rich legacy and diverse events make it a quintessential New York experience. Whether you're there for a sports event, a concert, or any other show, the atmosphere is electric and the energy is palpable. The seating arrangement ensures that even from the farthest seats, you're still part of the action.\n\nThe staff's friendliness and efficiency contribute to a seamless experience. Navigating the venue is hassle-free with clear signage and well-designed facilities. The range of food and beverage options available caters to all tastes, and the quality is surprisingly good for a large arena.\n\nIts central location makes it easily accessible, and stepping inside feels like stepping into a piece of New York history. The memories created within its walls are immeasurable, adding a layer of nostalgia to each visit. From a grand concert to a thrilling game, Madison Square Garden knows how to captivate its audience.\n\nFor its legacy, world-class events, and ability to create unforgettable moments, Madison Square Garden is undoubtedly deserving of a 5 out of 5 rating. It's a testament to New York's vibrant culture and entertainment scene."", 'time': 1692168576, 'translated': False}, {'author_name': 'Juan J. Moreno', 'author_url': 'https://www.google.com/maps/contrib/103546157009266159977/reviews', 'language': 'en', 'original_language': 'en', 'profile_photo_url': 'https://lh3.googleusercontent.com/a-/ALV-UjXEYVbnlw71o61_IHhS7u2kyMN92QNCE7nzpBflvnDc5Z7g=s128-c0x00000000-cc-rp-mo-ba6', 'rating': 5, 'relative_time_description': 'a month ago', 'text': 'Amazing from every perspective. From sports to music, this is one of the best Stadiums in the world. We went to a Maneskin show and it was astonishing. The entry and exit was fast and very easy. The view is magnificent from almost every seat in the stadium. You can buy food, drinks and stuff inside the Garden.', 'time': 1695356753, 'translated': False}, {'author_name': 'Alon Grinshpoon', 'author_url': 'https://www.google.com/maps/contrib/103640803241425122740/reviews', 'language': 'en', 'original_language': 'en', 'profile_photo_url': 'https://lh3.googleusercontent.com/a-/ALV-UjUYJ5DXUwYfwUiEFRvGdMtqAbWdj5K0EDJNinwHTNH5T4Y=s128-c0x00000000-cc-rp-mo-ba7', 'rating': 5, 'relative_time_description': 'a month ago', 'text': 'This place is an iconic event venue and arena! 🏟️ Madison Square Garden (or MSG) in NYC 🗽 is such a landmark and the perfect place to catch a massive concert 🎸, comedy show 😂, or game! 🏀 Their private suits and lounges 🛋️ are super cool. The ambience 🎶 is fantastic and the acoustic 🎵 is perfect! I wish I came here more often!', 'time': 1693794634, 'translated': False}]",,,4.7,Evening,3 hours for an event
"Intrepid Sea, Air & Space Museum","Pier 86, W 46th St, New York, NY 10036, USA",40.7648801,-74.0008306,Intrepid Museum,"{'language': 'en', 'overview': 'Flight museum on an aircraft carrier whose exhibits include a Concorde, submarine & space shuttle.'}","[{'author_name': 'Thomas Brown', 'author_url': 'https://www.google.com/maps/contrib/117673238403832333585/reviews', 'language': 'en', 'original_language': 'en', 'profile_photo_url': 'https://lh3.googleusercontent.com/a/ACg8ocISD-z4W8_TgFf0gGKj5121rB5PXSenwZgvUUtpR5_L=s128-c0x00000000-cc-rp-mo', 'rating': 5, 'relative_time_description': 'a month ago', 'text': 'Such a fantastic experience! Visiting during mine and my friends holiday to New York. Especially a must see if you have interests in military equipment, aircraft, boats and submarines. Level of detail on many exhibits was outstanding, staff also very friendly to talk to and also very knowledgeable. This attraction is located in a quieter area of New York, so a great place to visit to escape the crowds of Times Square, only a 30 minute walk away in fact! No queue to access the attraction, would recommend purchasing a city attraction pass or an advance ticket to guarantee entry, but looks like tickets can be purchased on site too. Fantastic how most of the museum is based on an aircraft carrier which saw active service! Some unique finds here including a space shuttle and also a submarine which you can walk through which was awesome. Its hard to believe how service men lived in such a small space for a couple of months with no\\ little daylight! Exhibits were very interactive too with information being plentyful. All aircraft etc looked to be well looked to be a great condition and was great to get up close to all. I saw some of the aircraft carrier was still being restored and quite understandably as a restoration on this scale will take a significant amount of time. I hope to return one day to find more of the aircraft carrier accessible! Definitely spend a day or at least 3-4 hours visiting this place, its certainly worth it! Will be recommending this place to family and friends.', 'time': 1695581661, 'translated': False}, {'author_name': 'Hannah Joy', 'author_url': 'https://www.google.com/maps/contrib/106402544794471211383/reviews', 'language': 'en', 'original_language': 'en', 'profile_photo_url': 'https://lh3.googleusercontent.com/a-/ALV-UjWF_NJci28JkY7X_Weh4vjvbaDOhSu3UkhfpiU912m8xXQ=s128-c0x00000000-cc-rp-mo-ba3', 'rating': 5, 'relative_time_description': 'a month ago', 'text': 'What an awesome experience!! If you like History. Boats, Planes, Submarines and Space this is the spot for you. Got in at first opening and did the submarine first as we were told the queue moves quite slowly, what an incredible piece of preserved history. Worth it just to go inside. so many things to see and do, staff were so helpful and great to talk to volunteers. A fantastic way to get away from the huddle of the city.', 'time': 1694252454, 'translated': False}, {'author_name': 'Mark Bird', 'author_url': 'https://www.google.com/maps/contrib/113427480358002698166/reviews', 'language': 'en', 'original_language': 'en', 'profile_photo_url': 'https://lh3.googleusercontent.com/a/ACg8ocJgZIrP5mk53s0N2T3Sr73LUIvKSEFK0TiTZWeSWw6T=s128-c0x00000000-cc-rp-mo-ba5', 'rating': 5, 'relative_time_description': 'a month ago', 'text': ""A great place to explore with a lot of interesting information, aircraft and items to see. Much of the aircraft carrier is accessible so you really get the feel for what life as a serving sailor would have been like. The submarine is also similarly impressive.  You'll need at least 3 hours there to get any level of detail.  Getting to the museum by public transport involves the metro and a bus, if you want to avoid a lengthy walk, but do your research and it's pretty plain sailing. A great place to visit, especially if you use discount opportunities like Sightseeing Pass etc."", 'time': 1694635455, 'translated': False}, {'author_name': 'Michael Patterson', 'author_url': 'https://www.google.com/maps/contrib/100840762929182999141/reviews', 'language': 'en', 'original_language': 'en', 'profile_photo_url': 'https://lh3.googleusercontent.com/a-/ALV-UjXMgwwrKoTwDtMML2OBuzFr4tNPtzBG2jrwDG9Zv52vx1w=s128-c0x00000000-cc-rp-mo-ba3', 'rating': 5, 'relative_time_description': 'a week ago', 'text': 'Loved my trip. First time in a aircraft carrier. It was really neat. There is a lot of history. Ww2, Korea and Vietnam wars. Important ship to 3 different conflicts. Had more than 3 admirals serve on the ship. You can even turn the rudder.', 'time': 1697596862, 'translated': False}, {'author_name': 'Alonzo Brown', 'author_url': 'https://www.google.com/maps/contrib/117193870858419854078/reviews', 'language': 'en', 'original_language': 'en', 'profile_photo_url': 'https://lh3.googleusercontent.com/a-/ALV-UjU6VmLy9RKwxXPR0S4x9AD176eRyc6Gn6TL425OhNK4G8w=s128-c0x00000000-cc-rp-mo-ba5', 'rating': 5, 'relative_time_description': 'a week ago', 'text': ""This is an amazing venue with awesome nautical and aeronautical displays and breathtaking views of the city and New Jersey that's great for adults and children.\nI would suggest planning out your parking well in advance.\nI did not and I had to pay 150.00 for  five hours at a parking garage five blocks away.\nCameras are welcome."", 'time': 1697837052, 'translated': False}]",,,4.6,Morning or Afternoon,2-3 hours
Whitney Museum of American Art,"99 Gansevoort St, New York, NY 10014, USA",40.73958770000001,-74.0088629,Whitney Museum of American Art,"{'language': 'en', 'overview': 'Museum exclusively featuring 20th-century & contemporary art by American artists, most still living.'}","[{'author_name': 'Jeffrey Usher', 'author_url': 'https://www.google.com/maps/contrib/116103112919316088393/reviews', 'language': 'en', 'original_language': 'en', 'profile_photo_url': 'https://lh3.googleusercontent.com/a-/ALV-UjX6e2DdSOvDcHtuslSft1euFRoQCXysJJzaIWTq3Zc2LNLs=s128-c0x00000000-cc-rp-mo-ba6', 'rating': 5, 'relative_time_description': 'a week ago', 'text': 'This museum is really nice. It has a wonderful view of the city. Fun tip! Whitney museum has a donation night on Fridays. You just have to RSVP beforehand. Wonderful place for a date night or just hanging out with friends and wanted to check out some cool art. The museum has six floors about four of them have art displays. I will definitely be coming again.', 'time': 1697726497, 'translated': False}, {'author_name': 'Anthony Skatz', 'author_url': 'https://www.google.com/maps/contrib/111529724238448082748/reviews', 'language': 'en', 'original_language': 'en', 'profile_photo_url': 'https://lh3.googleusercontent.com/a-/ALV-UjXZ2B4_TY8LjiuCFvbJV1RLKgjuN8_FBXeWNnxyjIdm63l0=s128-c0x00000000-cc-rp-mo-ba3', 'rating': 5, 'relative_time_description': 'a month ago', 'text': 'As someone who has been to a few museums, I really appreciated how ""modern-era"" the works were. From a traversal standpoint, it\'s far more vertical, so you\'re not really walking around each floor for really long stretches trying to find everything and getting lost. Lot of smaller floors versus two or three acres of land on three floors', 'time': 1694993717, 'translated': False}, {'author_name': 'A P', 'author_url': 'https://www.google.com/maps/contrib/103444633477760793825/reviews', 'language': 'en', 'original_language': 'en', 'profile_photo_url': 'https://lh3.googleusercontent.com/a/ACg8ocICHWrGjggLJOCAg6Eduixm8MM5_MpF5AKr8M9yeQ5W2A=s128-c0x00000000-cc-rp-mo', 'rating': 5, 'relative_time_description': '3 months ago', 'text': 'The Jaune Quick to See Smith exhibit was massive, beautiful and very moving. She’s so prolific and talented. Her work makes you think. There were also many other well-known American artists on display. It was nice and cool in there, too! No line whatsoever at Thursday mid-day. Helpful staff. Buy an e-ticket online in advance from their website and get scanned in. Walk over to Tea & Sympathy afterward for authentic English tea and cakes (or lunch or dinner) - an institution in the neighborhood since the 1990s.', 'time': 1690520574, 'translated': False}, {'author_name': 'Mekayah L.', 'author_url': 'https://www.google.com/maps/contrib/103255241020608089818/reviews', 'language': 'en', 'original_language': 'en', 'profile_photo_url': 'https://lh3.googleusercontent.com/a-/ALV-UjXV-nqmdP0W_pUL4az-Cxrx2cowQO5SQdFEdPB697IuIQ=s128-c0x00000000-cc-rp-mo-ba2', 'rating': 5, 'relative_time_description': 'a week ago', 'text': 'I had the experience of seeing Henry Taylor’s B-Side exhibit at the Whitney. It was absolutely amazing. I went with friends, it was a bit busy but it was the weekend. Would recommend a weekday to visit.', 'time': 1697995932, 'translated': False}, {'author_name': 'robert', 'author_url': 'https://www.google.com/maps/contrib/111363002876502131926/reviews', 'language': 'en', 'original_language': 'en', 'profile_photo_url': 'https://lh3.googleusercontent.com/a-/ALV-UjVVo03zeqXah_JbaJpwaLx3imI4nNeb0RFgbhsjCgCDkm4w=s128-c0x00000000-cc-rp-mo', 'rating': 5, 'relative_time_description': '4 months ago', 'text': ""Mostly love this architecturally striking museum.  Inside it is airy & it's large viewing areas preclude overcrowding.   The permanent collection has some of my favorite all time pieces.  The top floor special exhibition this past week was incredibly thought provoking.  And the outside deck on that floor has, as always, wonderful NYC views.  The only thing I was unhappy with was that the other viewing floors were closed, as well as their decks & the lovely restaurant.  The museum's location is also great, right at the beginning of the Highline."", 'time': 1687020543, 'translated': False}]",,,4.5,Morning,2-3 hours
