place_name,address,latitude,longitude,name,editorial_summary,reviews,type,price_level,rating,best_time_to_visit,average_duration_to_spend
Empire State Building,"20 W 34th St., New York, NY 10001, USA",40.7484405,-73.98566439999999,Empire State Building,"{'language': 'en', 'overview': 'Iconic, art deco office tower from 1931 with exhibits & observatories on the 86th & 102nd floors.'}","[{'author_name': 'Carla', 'author_url': 'https://www.google.com/maps/contrib/117692176919660335291/reviews', 'language': 'en', 'original_language': 'en', 'profile_photo_url': 'https://lh3.googleusercontent.com/a-/ALV-UjVMca7fmP4Yj5WGA0KNp4DeJCkvhV8DsIwwM9N6-VhS9Q=s128-c0x00000000-cc-rp-mo-ba4', 'rating': 5, 'relative_time_description': 'a week ago', 'text': 'Very enjoyable experience. I have done top of the rock and empire (twice) - I would choose the Empire State Building.\nIt is so iconic and a great experience.\nIt is a bit pricey if buying a ticket outside of a city pass. $52/adult. You can stay as long as you like though.\nVery accessible!!!!!!', 'time': 1697465670, 'translated': False}, {'author_name': 'Levi Cook', 'author_url': 'https://www.google.com/maps/contrib/112339200017142586645/reviews', 'language': 'en', 'original_language': 'en', 'profile_photo_url': 'https://lh3.googleusercontent.com/a-/ALV-UjX8u43m8Tus5bMEz2nJcg1vUcXQw9xnUtXEsba4pHoatl2u=s128-c0x00000000-cc-rp-mo-ba5', 'rating': 5, 'relative_time_description': '2 weeks ago', 'text': 'Most see building. Stunning  from inside  and outside. Incredible  view of the greatest  city, the city of New York. The lights from above are always  in trend with the holidays.  The food court delivers  a great variety  of food and beverages.  It is always  a good time to visit,but I truly recommend visiting before sunset. The colors are amazing , it droves you into a magic land.', 'time': 1697200977, 'translated': False}, {'author_name': 'Jose I', 'author_url': 'https://www.google.com/maps/contrib/118169195344827789029/reviews', 'language': 'en', 'original_language': 'en', 'profile_photo_url': 'https://lh3.googleusercontent.com/a/ACg8ocJUBYVxqt2kOhcRuo9pQFL0mfJctabiZOua19PHH-al=s128-c0x00000000-cc-rp-mo-ba5', 'rating': 5, 'relative_time_description': 'a week ago', 'text': ""Beautiful views!! It gets pretty chilly up there so you may want to bring a sweater or jacket.\n\nWe went on a September weekday, so the line was fast. There's some fun and interactive stuff to look at on the way up there."", 'time': 1697576339, 'translated': False}, {'author_name': 'Toni S (ToniTheTourist)', 'author_url': 'https://www.google.com/maps/contrib/112803441211792945110/reviews', 'language': 'en', 'original_language': 'en', 'profile_photo_url': 'https://lh3.googleusercontent.com/a-/ALV-UjXbdDBghoQYNy1dk9xU5iNqJvefE6JN1CwMuq3W1I0YFuM=s128-c0x00000000-cc-rp-mo-ba6', 'rating': 5, 'relative_time_description': '3 weeks ago', 'text': 'I enjoyed visiting the Empire State building. Inside the building is an educational section that explains how the building was built and why. After visiting I feel like I know a lot more than I didn’t know before I came.\nWhen you get up to the top there are additional areas that are higher up. They will give you the option to pay extra. We did not do the option to go up further because we felt like we were able to see quite a bit from where we were.\n\nThere’s a walkway outside the building that allows you to view the city from many different angles and also take lots of great photos.\n\nWe were there at night. Because it was dark, It was kind of hard trying to determine what we were looking at unless it was water or a building with distinct features. Still a very beautiful view .\nI feel we need to come back in the daytime to see that fantastic view.\n\n#TTip: get your tickets ahead of time and make sure to pick the time you actually want to go. They have night time openings but they will not let you go inside the building before your exact appointment time. Because they implemented his policy about 15 minutes prior to your lot of time you will see many many people get in line at the very same time to go in. Make sure you get there early or you will be at the back of a very long line.', 'time': 1696735525, 'translated': False}, {'author_name': 'Juraj Podsklan', 'author_url': 'https://www.google.com/maps/contrib/104163615391058026982/reviews', 'language': 'en', 'original_language': 'en', 'profile_photo_url': 'https://lh3.googleusercontent.com/a-/ALV-UjU1VaM_S8HiSYZrf-wSts0iFdRulhn6ikYv6T--8R_Jdz0M=s128-c0x00000000-cc-rp-mo-ba6', 'rating': 5, 'relative_time_description': 'a month ago', 'text': ""If you're visiting Manhattan or New York in general to do sightseeing then this should be on your list of places to visit.\n\nIt was part of our NYC pass so we used that to get our tickets, but we had to run in during the day between other attractions to get it. The website of the provider of passes did not allow us to book ahead.\nLuckily we were visiting on a Thursday at the beginning of September so it wasn't busy late in the evening, and there were barely a couple of dozen people at the observation deck at 10:45pm when we came.\n\nWe visited other observation decks during the day, so it was nice to do this one in the dark with all the city lights surrounding us. The weather was good, no clouds, maybe a bit windy, so that's definitely something to keep in mind and plan for ahead of time, if you can, since you don't want to be stuck in cloud cover and not see anything at all.\n\nOut of the Empire State building, Top of the Rock, One World Trade Centre and the Edge, we'd definitely plan to visit this one again. Not that the others are bad, it's just that they can't really beat the original - at least not yet."", 'time': 1694488049, 'translated': False}]",,,4.7,Evening,1-2 hours
The High Line,"New York, NY 10011, USA",40.7479925,-74.0047649,The High Line,"{'language': 'en', 'overview': 'Popular park 30 feet above street level on an old rail line, with river & city views.'}","[{'author_name': 'Austin Carson', 'author_url': 'https://www.google.com/maps/contrib/118240383996400933125/reviews', 'language': 'en', 'original_language': 'en', 'profile_photo_url': 'https://lh3.googleusercontent.com/a-/ALV-UjXtccbrrM03MsH6P7Wz6oEUnQFXrE2nD2WL59KBTInnY08=s128-c0x00000000-cc-rp-mo-ba4', 'rating': 5, 'relative_time_description': 'a week ago', 'text': ""Let me start by saying if you don't like walking, this probably isn't the spot for you. Now that said it's definitely a nice walk above the city that gives you some unique views of different parts of the city and other buildings. The old train tracks, gardens and sculptures are all beautiful and make the walk that much better."", 'time': 1697765782, 'translated': False}, {'author_name': 'Ashley H', 'author_url': 'https://www.google.com/maps/contrib/105733116724535045679/reviews', 'language': 'en', 'original_language': 'en', 'profile_photo_url': 'https://lh3.googleusercontent.com/a-/ALV-UjXOBrMa2gDF-0AYHaKmrznoLJaBv5_tOpZhPNO3_e_bOmuX=s128-c0x00000000-cc-rp-mo-ba6', 'rating': 5, 'relative_time_description': 'a week ago', 'text': 'Beautiful “park” path located on retired elevated train tracks through the city. It’s a magical combo of lush and interesting landscaping, art and murals, NY city views and Hudson River views. It’s free to access, and a must see for a NYC trip. We walked North to south, starting at the Vessel and got down at the Chelsea Market. 100% recommend and would do again.', 'time': 1697588202, 'translated': False}, {'author_name': 'Matt Hobbs', 'author_url': 'https://www.google.com/maps/contrib/107581206372610590610/reviews', 'language': 'en', 'original_language': 'en', 'profile_photo_url': 'https://lh3.googleusercontent.com/a/ACg8ocLeivoLxtaUK2UWL_5LGFNtPOqKAIq35MJo2vFNA-NQ=s128-c0x00000000-cc-rp-mo-ba4', 'rating': 5, 'relative_time_description': 'in the last week', 'text': 'Amazing wall through  the city on an old  above ground subway line. Beautifully landscaped walk, with lots to see on route. There are some food outlets after the first 1/4 of the route from the southern end, not sure how seasonal they are.  Worth a worth a walk by day and by night to see some very different scenes.', 'time': 1698512788, 'translated': False}, {'author_name': 'Ashish Satyabhashak', 'author_url': 'https://www.google.com/maps/contrib/114189339756427701921/reviews', 'language': 'en', 'original_language': 'en', 'profile_photo_url': 'https://lh3.googleusercontent.com/a-/ALV-UjWI1Nzly9OwZQSHlno9xm-AB5zL1k-oXChnYtLMcX048dhN=s128-c0x00000000-cc-rp-mo-ba6', 'rating': 5, 'relative_time_description': 'a month ago', 'text': 'This is recycling at the best. Instead of demolishing the old railway track and creating environmental disasters, rather save the structure and put it back in work by creating urban oasis in the middle of the concrete jungle. I visited the first time when it was opened for the first time. In my second visit, I was surprised by the plant growth on the high line. High line has distinct wild flower growth, and you can select your choice of wild flower by completing the survey. Instead of visiting expensive botanical gardens in different boroughs, you get similar seasonal flowers and plant exposure on a high line for free.  This is a must-see attraction for the visitors along with Vessel. You can start from Chelsea all the way to Vessel in Hudson Yard. There are refreshments stalls and constant changing public art on display besides breathtaking views. Restrooms 🚻 are available at both ends. One can easily hop off to newly created Little Island Park. If you decide to spend more time, then benches and water features are there to rest and relax. Some portion of the high line is under renovations by Jacob Javits Center. Please follow the rules and regulations of the park.', 'time': 1694931135, 'translated': False}, {'author_name': 'Saurabh Vinchu', 'author_url': 'https://www.google.com/maps/contrib/102577973559772863648/reviews', 'language': 'en', 'original_language': 'en', 'profile_photo_url': 'https://lh3.googleusercontent.com/a-/ALV-UjWstzGbuP0iNEEEOS_lP9N0pRegih4uGBTZy0N9uaDvF9uV=s128-c0x00000000-cc-rp-mo-ba6', 'rating': 5, 'relative_time_description': 'a month ago', 'text': 'This is such an amazing idea that I wish more cities had something similar. The whole line is full of different plants and sculptures. You will find local vendors and also be able to see a few touristy spots along the way. There are gardens, and ice cream shops and water features along the way. You can also walk to the vessel from here.', 'time': 1694078116, 'translated': False}]",,,4.7,Morning or Afternoon,1-2 hours
One World Observatory,"117 West St, New York, NY 10007, USA",40.7130062,-74.013173,One World Observatory,"{'language': 'en', 'overview': 'Observatory located on floors 100-102 of One World Trade Center, with exhibits & restaurants.'}","[{'author_name': 'atulh jindall', 'author_url': 'https://www.google.com/maps/contrib/102955250396489494309/reviews', 'language': 'en', 'original_language': 'en', 'profile_photo_url': 'https://lh3.googleusercontent.com/a/ACg8ocKzhP34_YmderOuk2glim-3q6FLYEATROYQ5bpyw6gk=s128-c0x00000000-cc-rp-mo-ba4', 'rating': 4, 'relative_time_description': 'in the last week', 'text': 'Nice views, i visited empire state 4.5 years ago and is open with just mesh. There is no glass on empire state building top floor. I personally liked it more. Overall view was very nice from one world observatory. I personally enjoyed open area of empire state and you can feel breeze of air. Overall both are great with their own pros and cons and becomes matter of personal choice.', 'time': 1698451850, 'translated': False}, {'author_name': 'Ellyu', 'author_url': 'https://www.google.com/maps/contrib/106211418126805000643/reviews', 'language': 'en', 'original_language': 'en', 'profile_photo_url': 'https://lh3.googleusercontent.com/a-/ALV-UjUWFCswWML7l6bCk66q-eefzBUrZhzrsyLY1b8LOq-fhczh=s128-c0x00000000-cc-rp-mo-ba4', 'rating': 5, 'relative_time_description': 'a month ago', 'text': ""Really cool observation deck. This was our very first time visiting this particular observation deck and we enjoyed it a lot! We also stopped for drinks at the bar up there which were great while enjoying the panoramic views. If you use the Go City Explorer pass, that includes admission to the observation deck and a discount for the drinks as well (10$/drink instead of their menu prices, but it only includes one type of cocktail/not all and probably most beers, glasses of wine, etc).\nWe went on a Friday afternoon (around 3-4 PM) and while it was busy, there wasn't too much of a wait time, so that was great. We didn't need a reservation, so that was great, but also keep in mind that they have a security check line and you should check their website before going for any prohibited items like tripods, etc. And remember to have lots of fun, we certainly did!"", 'time': 1695002217, 'translated': False}, {'author_name': 'Alex G', 'author_url': 'https://www.google.com/maps/contrib/109831122759823659664/reviews', 'language': 'en', 'original_language': 'en', 'profile_photo_url': 'https://lh3.googleusercontent.com/a/ACg8ocLVRis3MmmxSIklOWjwje_xuWbhAL8M4wVFCMMx4SON=s128-c0x00000000-cc-rp-mo-ba3', 'rating': 5, 'relative_time_description': 'in the last week', 'text': ""Very well designed with futuristic experience. If you like legacy building then go to Empire's estate but if you want to see futuristic building then One World Observatory is a no brainer. It has the fastest elevator in northern hemisphere and the lift has LCD screen on 3 sides. Staff is very polite and helpful.\nFor best view go 1-2 hours before the sunset. You can also buy tickets on Groupon one day in advance."", 'time': 1698208098, 'translated': False}, {'author_name': 'Jules Lasne', 'author_url': 'https://www.google.com/maps/contrib/105356010670773863083/reviews', 'language': 'en', 'original_language': 'en', 'profile_photo_url': 'https://lh3.googleusercontent.com/a-/ALV-UjVdiYVt0urkYbx8Gour9dOwx7kE-HCiKh0FHf8UK8En9OvI=s128-c0x00000000-cc-rp-mo-ba4', 'rating': 2, 'relative_time_description': 'a week ago', 'text': 'The view is quite nice, although often obstructed by other people taking pictures. It can get quite crowded and queuing to get up to the observatory feels like a Disney ride.\n\nFor 45$ each (DO NOT TAKE THE EXPRESS+ TICKETS, NOT WORTH IT), it was too expensive for what it is.', 'time': 1697482722, 'translated': False}, {'author_name': 'Raphy Wallace', 'author_url': 'https://www.google.com/maps/contrib/102898982173758760503/reviews', 'language': 'en', 'original_language': 'en', 'profile_photo_url': 'https://lh3.googleusercontent.com/a-/ALV-UjVXNVuQyk-nrp9hdc3OsZWo55488J1XSopT_UQtKfRZWuw=s128-c0x00000000-cc-rp-mo-ba4', 'rating': 3, 'relative_time_description': 'in the last week', 'text': 'I was impressed by the elevator going up to 102 floors in 1 minute or less. The vue is really nice 360. But I was a bit disappointed because I thought it was like the Edge : you can see the city under your feet. And of course everything is expensive over there.', 'time': 1698338449, 'translated': False}]",,3,4.7,Morning or Afternoon,1-2 hours
Radio City Music Hall,"1260 6th Ave, New York, NY 10020, USA",40.75997599999999,-73.9799772,Radio City Music Hall,"{'language': 'en', 'overview': 'Circa-1932 art deco theater hosting the Christmas Spectacular with the Rockettes, concerts & more.'}","[{'author_name': 'Ralph', 'author_url': 'https://www.google.com/maps/contrib/107236359078588554170/reviews', 'language': 'en', 'original_language': 'en', 'profile_photo_url': 'https://lh3.googleusercontent.com/a-/ALV-UjUT_sI_wjR_UZNFFZtHS7P755ROuNUjFycDyojhZLwDMnbz=s128-c0x00000000-cc-rp-mo-ba4', 'rating': 4, 'relative_time_description': 'a week ago', 'text': 'Took a little to get in, even though we were there an hour after doors opened. Long lines for food and beers. Long lines for bathrooms occasionally. Beers and food $12.50-15. Nice staff. Beautiful venue. We had mezzanine seats and the audio was great. Navigating to our seats was easy as well. Would def come back again.', 'time': 1697502186, 'translated': False}, {'author_name': 'Dee Dee Foodie4life', 'author_url': 'https://www.google.com/maps/contrib/108507724599672612631/reviews', 'language': 'en', 'original_language': 'en', 'profile_photo_url': 'https://lh3.googleusercontent.com/a-/ALV-UjWPA9vWfWZfGAKqG4sL6vzVu10YCvgqzHPwYy1CFzdJsQKq=s128-c0x00000000-cc-rp-mo-ba7', 'rating': 5, 'relative_time_description': '3 months ago', 'text': ""July 21, 2023\n\nRadio City Music Hall in all its brilliance was fantastic!! The old theater was beautifully decorated. The acoustics were phenomenal. The seats in the 4th row were great with plenty of legroom (6 feet tall). We were ushered through security swiftly. The concert was the best I've ever attended.  ❤️"", 'time': 1690220557, 'translated': False}, {'author_name': 'I W', 'author_url': 'https://www.google.com/maps/contrib/114287474998376978481/reviews', 'language': 'en', 'original_language': 'en', 'profile_photo_url': 'https://lh3.googleusercontent.com/a-/ALV-UjXM6wOIL_oD7JIr5tttD3V6wb1OVWkmmJn89jVg_LT5Neo=s128-c0x00000000-cc-rp-mo-ba4', 'rating': 5, 'relative_time_description': '3 months ago', 'text': 'Incredible art deco room, designed by Donald Deskey, with soaring proscenium rings framing the legendary stage.  We saw First Aid Kit to a nearly full house.  Sound and view lines were excellent. Seats spotless.  Staff efficient.  A treasure in NY that deserves to be seen and not just at Christmas.', 'time': 1689870079, 'translated': False}, {'author_name': 'Krishna Sudarshan', 'author_url': 'https://www.google.com/maps/contrib/109090419973932543101/reviews', 'language': 'en', 'original_language': 'en', 'profile_photo_url': 'https://lh3.googleusercontent.com/a-/ALV-UjXjGZWMx41Vd_0UXJT24t9Z2eEXmgcW4qoWGvkDWUJJJVOu=s128-c0x00000000-cc-rp-mo-ba7', 'rating': 5, 'relative_time_description': '2 months ago', 'text': 'My visit to Radio City Music Hall in NYC was an unforgettable experience shared with a dear friend. The grandeur of this iconic venue is breathtaking, from the elegant Art Deco architecture to the opulent interiors that exude a timeless charm. The vast auditorium seemed to come alive as we took our seats, eagerly anticipating the performance. The impeccable acoustics and the sheer magnitude of the stage left us in awe. As the show began, the atmosphere was electric, and every note, every movement seemed to resonate with the very soul of the city. It was a night of pure magic, a shared memory etched forever in our hearts.', 'time': 1691787985, 'translated': False}, {'author_name': 'Jon (JSR)', 'author_url': 'https://www.google.com/maps/contrib/108673282108159075484/reviews', 'language': 'en', 'original_language': 'en', 'profile_photo_url': 'https://lh3.googleusercontent.com/a-/ALV-UjXaLZuZljle5Ay4vDEpZ5JpDabh0o-pptQ_923qX8Q3jPAj=s128-c0x00000000-cc-rp-mo-ba6', 'rating': 5, 'relative_time_description': '4 months ago', 'text': 'Visited here for the first time for a Charlie Puth concert (even tho I pass by this place often), and it is a beautiful building. Inside is massive and love all the architectures within.\n\nThe concert itself was a blast, and security was very efficient and quick. A beautiful space for a concert.', 'time': 1687447588, 'translated': False}]",,,4.8,Evening,2-3 hours for a show
Rockefeller Center,"45 Rockefeller Plaza, New York, NY 10111, USA",40.7587402,-73.9786736,Rockefeller Center,"{'language': 'en', 'overview': ""Famous complex that's home to TV studios, plus a seasonal ice rink & a giant Christmas tree.""}","[{'author_name': 'Charlie', 'author_url': 'https://www.google.com/maps/contrib/110091488706273592914/reviews', 'language': 'en', 'original_language': 'en', 'profile_photo_url': 'https://lh3.googleusercontent.com/a-/ALV-UjVJKPMyhRZB606lZ0YGXBoTubEB8QGoxcc-0VlsL38C7Fk=s128-c0x00000000-cc-rp-mo-ba6', 'rating': 5, 'relative_time_description': 'in the last week', 'text': 'Rockefeller Center, an iconic symbol of New York City, stands as a testament to art, commerce, and innovation. This historic complex, spanning 22 acres in Midtown Manhattan, is a vibrant hub of entertainment, shopping, and culture. Home to the renowned Radio City Music Hall, it hosts the legendary Radio City Christmas Spectacular, captivating audiences with its dazzling performances. The Top of the Rock Observation Deck offers breathtaking panoramic views of the city skyline, while the Rockefeller Plaza, adorned with the famous Prometheus statue, buzzes with activity, especially during the winter when it transforms into a magical ice-skating rink. With its art deco architecture and a rich history, Rockefeller Center remains a must-visit destination, embodying the spirit and energy of New York City.', 'time': 1698321703, 'translated': False}, {'author_name': 'Gabriella Scannadinari', 'author_url': 'https://www.google.com/maps/contrib/113352610746442944503/reviews', 'language': 'en', 'original_language': 'en', 'profile_photo_url': 'https://lh3.googleusercontent.com/a-/ALV-UjWxOhrgk1U7Zp4Zb8tzkSI00tJKiAmSwhZ37HZMJGlVBw=s128-c0x00000000-cc-rp-mo-ba4', 'rating': 5, 'relative_time_description': 'in the last week', 'text': 'Amazing place! Reminds me all movies I saw at the cinema. Already installed the ice skating area. Unfortunately I can’t see the Christmas tree because is too early for Xmas, hope to can return in NY in another period.', 'time': 1698099924, 'translated': False}, {'author_name': 'Natalia Dimitrova', 'author_url': 'https://www.google.com/maps/contrib/102209103917312270089/reviews', 'language': 'en', 'original_language': 'en', 'profile_photo_url': 'https://lh3.googleusercontent.com/a-/ALV-UjVtyGLGbgzh8YHYPbX2enp1WcpQRq3KrkW9ayIsYlHDvq4=s128-c0x00000000-cc-rp-mo-ba4', 'rating': 4, 'relative_time_description': 'a week ago', 'text': ""View from Top of the Rock was magnificent! But the place where you watch it from is not that good. It's fully open, and if it's chilly, you are cold. When I went, it wasn't fully constructed, there was a lot of unused place. They can make at least a small souvenir shop at the top or a small bar for drinks. Since there is nothing else to do rather than watching the view, it's overcrowded and it can be a challenge to find yourself a good spot, especially at peak hours from 6pm to 7, 7 30pm. And if you go to the upper side - really windy - so bring a jacket. I got a small cold after being exposed to the cold wind at sunset.\nOh, and it's kinda hard to find where to go in order to go to the Top of the rock - maybe some more signs for better guidance."", 'time': 1697490257, 'translated': False}, {'author_name': 'Naomi Sprung', 'author_url': 'https://www.google.com/maps/contrib/106385073626488626784/reviews', 'language': 'en', 'original_language': 'en', 'profile_photo_url': 'https://lh3.googleusercontent.com/a-/ALV-UjWisTF0kGAkWCiJ_-5a_BAeubwux4OKDBChTe9epR4jVTyO=s128-c0x00000000-cc-rp-mo-ba6', 'rating': 5, 'relative_time_description': '3 weeks ago', 'text': 'Super cool and lively place. It’s always jumping. There are so many things to see and fun places to eat and the city has a rhythm all its own. Each building is interesting to look at, constant foot and car traffic and even fun graffiti to look at. There’s no place like New York!', 'time': 1696461002, 'translated': False}, {'author_name': 'Clive Goudercourt', 'author_url': 'https://www.google.com/maps/contrib/107326301318038817294/reviews', 'language': 'en', 'original_language': 'en', 'profile_photo_url': 'https://lh3.googleusercontent.com/a-/ALV-UjVrfzim5zfKP0DAuxiC0Jk7Cbpixj_WX2UdcVTwCFP4Zvva=s128-c0x00000000-cc-rp-mo-ba4', 'rating': 4, 'relative_time_description': 'a month ago', 'text': 'Very expensive but worth it for the views would only do this once. Some areas at the top were shut off but as it was quiet we had good access to all the best viewing points. The view of Central Park was amazing. Highly recommend if you’re in NY.', 'time': 1695555436, 'translated': False}]",,,4.7,Afternoon or Evening,1-2 hours
